{
  "schema_version": 4,
  "id": "fixture:third_ward",
  "display_name_key": "hero.fixture.third_ward.name",
  "greed": 80,
  "caution": 0,
  "pride": 0,
  "trust_in_guild": 50,
  "capability": {
    "grade": 50,
    "expertise": {
      "frontline": 50,
      "wilderness": 50
    }
  },
  "traits": [
    "fixture:warded_principle"
  ],
  "relationships": []
}
